{
  "source": {
    "id": "reference-data",
    "name": "앱에 넣는 기본 데이터 (국가·통화·도시·지도 경계)",
    "url": "https://github.com/datasets",
    "license": "Repository metadata via repos.ecosyste.ms (CC BY-SA 4.0). DataHub core datasets are mostly ODC-PDDL; each repository keeps its own license (field license).",
    "note": "GitHub 'datasets' 조직(DataHub core datasets) 전체(별 5개 이상) + 널리 쓰는 참조 데이터 저장소: dr5hn/countries-states-cities-database, mledoze/countries, umpirsky/country-list, annexare/Countries, lukes/ISO-3166-Countries-with-Regional-Codes, datasets/country-codes, southkorea/southkorea-maps, vuski/admdongkor, johan/world.geo.json, nvkelso/natural-earth-vector, unicode-org/cldr-json, samayo/country-json (고른 목록은 코드잇소)."
  },
  "fetchedAt": "2026-10-26",
  "count": 120,
  "items": [
    {
      "id": "reference-data:annexare--countries",
      "name": "Countries",
      "kind": "sample-data",
      "category": "datasets",
      "summary": "Countries, Languages & Continents data (capital and currency, native name, calling codes).",
      "url": "https://github.com/annexare/Countries",
      "source": {
        "name": "GitHub",
        "url": "https://github.com"
      },
      "license": "MIT",
      "metrics": {
        "stars": 1333,
        "updatedAt": "2026-10-14"
      },
      "tags": [
        "calling-codes",
        "capital",
        "cjs",
        "continent",
        "countries",
        "country-codes",
        "reference-data"
      ],
      "preview": {
        "type": "repo",
        "homepage": "https://annexare.github.io/Countries/",
        "host": "github",
        "language": "TypeScript",
        "repo": "annexare/Countries"
      },
      "use": {
        "install": "git clone https://github.com/annexare/Countries.git"
      },
      "fetchedAt": "2026-10-20"
    },
    {
      "id": "reference-data:datasets--airport-codes",
      "name": "airport-codes",
      "kind": "sample-data",
      "category": "datasets",
      "summary": "List of Airport codes, locations and other information around the world",
      "url": "https://github.com/datasets/airport-codes",
      "source": {
        "name": "DataHub core datasets (GitHub datasets)",
        "url": "https://github.com/datasets"
      },
      "metrics": {
        "stars": 384,
        "updatedAt": "2026-10-16"
      },
      "tags": [
        "reference-data"
      ],
      "preview": {
        "type": "repo",
        "homepage": "https://datahub.io/core/airport-codes",
        "host": "github",
        "language": "Python",
        "repo": "datasets/airport-codes"
      },
      "use": {
        "install": "git clone https://github.com/datasets/airport-codes.git"
      },
      "fetchedAt": "2026-10-20"
    },
    {
      "id": "reference-data:datasets--bond-yields-gov-long-term",
      "name": "bond-yields-gov-long-term",
      "kind": "sample-data",
      "category": "datasets",
      "summary": "Long term government bond yields",
      "url": "https://github.com/datasets/bond-yields-gov-long-term",
      "source": {
        "name": "DataHub core datasets (GitHub datasets)",
        "url": "https://github.com/datasets"
      },
      "metrics": {
        "stars": 7,
        "updatedAt": "2026-10-01"
      },
      "tags": [
        "reference-data"
      ],
      "preview": {
        "type": "repo",
        "host": "github",
        "language": "Python",
        "repo": "datasets/bond-yields-gov-long-term"
      },
      "use": {
        "install": "git clone https://github.com/datasets/bond-yields-gov-long-term.git"
      },
      "fetchedAt": "2026-10-20"
    },
    {
      "id": "reference-data:datasets--bond-yields-us-10y",
      "name": "bond-yields-us-10y",
      "kind": "sample-data",
      "category": "datasets",
      "summary": "10 year nominal yields on US government bonds from the Federal Reserve",
      "url": "https://github.com/datasets/bond-yields-us-10y",
      "source": {
        "name": "DataHub core datasets (GitHub datasets)",
        "url": "https://github.com/datasets"
      },
      "metrics": {
        "stars": 21,
        "updatedAt": "2026-10-01"
      },
      "tags": [
        "reference-data"
      ],
      "preview": {
        "type": "repo",
        "homepage": "https://datahub.io/core/bond-yields-us-10y",
        "host": "github",
        "language": "Python",
        "repo": "datasets/bond-yields-us-10y"
      },
      "use": {
        "install": "git clone https://github.com/datasets/bond-yields-us-10y.git"
      },
      "fetchedAt": "2026-10-20"
    },
    {
      "id": "reference-data:datasets--breast-cancer",
      "name": "breast-cancer",
      "kind": "sample-data",
      "category": "datasets",
      "summary": "Breast cancer occurrences.",
      "url": "https://github.com/datasets/breast-cancer",
      "source": {
        "name": "DataHub core datasets (GitHub datasets)",
        "url": "https://github.com/datasets"
      },
      "metrics": {
        "stars": 27,
        "updatedAt": "2026-05-22"
      },
      "tags": [
        "reference-data"
      ],
      "preview": {
        "type": "repo",
        "homepage": "https://datahub.io/machine-learning/breast-cancer",
        "host": "github",
        "language": "Python",
        "repo": "datasets/breast-cancer"
      },
      "use": {
        "install": "git clone https://github.com/datasets/breast-cancer.git"
      },
      "fetchedAt": "2026-10-20"
    },
    {
      "id": "reference-data:datasets--browser-stats",
      "name": "browser-stats",
      "kind": "sample-data",
      "category": "datasets",
      "summary": "Web browser usage statistics",
      "url": "https://github.com/datasets/browser-stats",
      "source": {
        "name": "DataHub core datasets (GitHub datasets)",
        "url": "https://github.com/datasets"
      },
      "metrics": {
        "stars": 21,
        "updatedAt": "2024-10-30"
      },
      "tags": [
        "reference-data"
      ],
      "preview": {
        "type": "repo",
        "host": "github",
        "language": "Python",
        "repo": "datasets/browser-stats"
      },
      "use": {
        "install": "git clone https://github.com/datasets/browser-stats.git"
      },
      "fetchedAt": "2026-10-20"
    },
    {
      "id": "reference-data:datasets--carbondoomsday",
      "name": "carbondoomsday",
      "kind": "sample-data",
      "category": "datasets",
      "summary": "Carbon dashboard on datahub",
      "url": "https://github.com/datasets/carbondoomsday",
      "source": {
        "name": "DataHub core datasets (GitHub datasets)",
        "url": "https://github.com/datasets"
      },
      "license": "MIT",
      "metrics": {
        "stars": 45,
        "updatedAt": "2025-03-06"
      },
      "tags": [
        "reference-data"
      ],
      "preview": {
        "type": "repo",
        "homepage": "https://carbon.datahub.io/",
        "host": "github",
        "language": "CSS",
        "repo": "datasets/carbondoomsday"
      },
      "use": {
        "install": "git clone https://github.com/datasets/carbondoomsday.git"
      },
      "fetchedAt": "2026-10-20"
    },
    {
      "id": "reference-data:datasets--cash-surplus-deficit",
      "name": "cash-surplus-deficit",
      "kind": "sample-data",
      "category": "datasets",
      "summary": "Cash Surplus/Deficit (% of GDP), from 1990 to 2013",
      "url": "https://github.com/datasets/cash-surplus-deficit",
      "source": {
        "name": "DataHub core datasets (GitHub datasets)",
        "url": "https://github.com/datasets"
      },
      "metrics": {
        "stars": 6,
        "updatedAt": "2026-08-01"
      },
      "tags": [
        "reference-data"
      ],
      "preview": {
        "type": "repo",
        "homepage": "https://datahub.io/core/cash-surplus-deficit",
        "host": "github",
        "language": "Python",
        "repo": "datasets/cash-surplus-deficit"
      },
      "use": {
        "install": "git clone https://github.com/datasets/cash-surplus-deficit.git"
      },
      "fetchedAt": "2026-10-20"
    },
    {
      "id": "reference-data:datasets--cervical-cancer",
      "name": "cervical-cancer",
      "kind": "sample-data",
      "category": "datasets",
      "summary": "Cervical cancer occurrences",
      "url": "https://github.com/datasets/cervical-cancer",
      "source": {
        "name": "DataHub core datasets (GitHub datasets)",
        "url": "https://github.com/datasets"
      },
      "metrics": {
        "stars": 6,
        "updatedAt": "2025-02-03"
      },
      "tags": [
        "reference-data"
      ],
      "preview": {
        "type": "repo",
        "homepage": "https://datahub.io/machine-learning/cervical-cancer",
        "host": "github",
        "language": "Python",
        "repo": "datasets/cervical-cancer"
      },
      "use": {
        "install": "git clone https://github.com/datasets/cervical-cancer.git"
      },
      "fetchedAt": "2026-10-20"
    },
    {
      "id": "reference-data:datasets--cirp-survey-of-freshmen",
      "name": "cirp-survey-of-freshmen",
      "kind": "sample-data",
      "category": "datasets",
      "summary": "Results from freshmen survey conducted by CIRP",
      "url": "https://github.com/datasets/cirp-survey-of-freshmen",
      "source": {
        "name": "DataHub core datasets (GitHub datasets)",
        "url": "https://github.com/datasets"
      },
      "metrics": {
        "stars": 5,
        "updatedAt": "2024-10-25"
      },
      "tags": [
        "reference-data"
      ],
      "preview": {
        "type": "repo",
        "homepage": "https://datahub.io/core/cirp-survey-of-freshmen",
        "host": "github",
        "language": "Python",
        "repo": "datasets/cirp-survey-of-freshmen"
      },
      "use": {
        "install": "git clone https://github.com/datasets/cirp-survey-of-freshmen.git"
      },
      "fetchedAt": "2026-10-20"
    },
    {
      "id": "reference-data:datasets--clinical-trials-us",
      "name": "clinical-trials-us",